PassengerId,Survived,Pclass,Name,Sex,Age,SibSp,Parch,Ticket,Fare,Cabin,Embarked
378,0,1,"Widener, Mr. Harry Elkins",male,27,0,2,113503,211.5,C82,C
815,0,3,"Tomlin, Mr. Ernest Portage",male,30.5,0,0,364499,8.05,,S
1129,NA,3,"Baccos, Mr. Raffull",male,20,0,0,2679,7.225,,C
1066,NA,3,"Asplund, Mr. Carl Oscar Vilhelm Gustafsson",male,40,1,5,347077,31.3875,,S
445,1,3,"Johannesen-Bratthammer, Mr. Bernt",male,NA,0,0,65306,8.1125,,S
60,0,3,"Goodwin, Master. William Frederick",male,11,5,2,CA 2144,46.9,,S
705,0,3,"Hansen, Mr. Henrik Juul",male,26,1,0,350025,7.8542,,S
1196,NA,3,"McCarthy, Miss. Catherine Katie""""",female,NA,0,0,383123,7.75,,Q
286,0,3,"Stankovic, Mr. Ivan",male,33,0,0,349239,8.6625,,C
457,0,1,"Millet, Mr. Francis Davis",male,65,0,0,13509,26.55,E38,S
491,0,3,"Hagland, Mr. Konrad Mathias Reiersen",male,NA,1,0,65304,19.9667,,S
823,0,1,"Reuchlin, Jonkheer. John George",male,38,0,0,19972,0,,S
1226,NA,3,"Cor, Mr. Ivan",male,27,0,0,349229,7.8958,,S
869,0,3,"van Melkebeke, Mr. Philemon",male,NA,0,0,345777,9.5,,S
300,1,1,"Baxter, Mrs. James (Helene DeLaudeniere Chaput)",female,50,0,1,PC 17558,247.5208,B58 B60,C
872,1,1,"Beckwith, Mrs. Richard Leonard (Sallie Monypeny)",female,47,1,1,11751,52.5542,D35,S
1012,NA,2,"Watt, Miss. Bertha J",female,12,0,0,C.A. 33595,15.75,,S
1015,NA,3,"Carver, Mr. Alfred John",male,28,0,0,392095,7.25,,S
480,1,3,"Hirvonen, Miss. Hildur E",female,2,0,1,3101298,12.2875,,S
634,0,1,"Parr, Mr. William Henry Marsh",male,NA,0,0,112052,0,,S
196,1,1,"Lurette, Miss. Elise",female,58,0,0,PC 17569,146.5208,B80,C
950,NA,3,"Davison, Mr. Thomas Henry",male,NA,1,0,386525,16.1,,S
562,0,3,"Sivic, Mr. Husein",male,40,0,0,349251,7.8958,,S
780,1,1,"Robert, Mrs. Edward Scott (Elisabeth Walton McMillan)",female,43,0,1,24160,211.3375,B3,S
