PassengerId,Survived,Pclass,Name,Sex,Age,SibSp,Parch,Ticket,Fare,Cabin,Embarked
211,0,3,"Ali, Mr. Ahmed",male,24,0,0,SOTON/O.Q. 3101311,7.05,,S
969,NA,1,"Cornell, Mrs. Robert Clifford (Malvina Helen Lamson)",female,55,2,0,11770,25.7,C101,S
189,0,3,"Bourke, Mr. John",male,40,1,1,364849,15.5,,Q
239,0,2,"Pengelly, Mr. Frederick William",male,19,0,0,28665,10.5,,S
733,0,2,"Knight, Mr. Robert J",male,NA,0,0,239855,0,,S
857,1,1,"Wick, Mrs. George Dennick (Mary Hitchcock)",female,45,1,1,36928,164.8667,,S
916,NA,1,"Ryerson, Mrs. Arthur Larned (Emily Maria Borie)",female,48,1,3,PC 17608,262.375,B57 B59 B63 B66,C
940,NA,1,"Bucknell, Mrs. William Robert (Emma Eliza Ward)",female,60,0,0,11813,76.2917,D15,C
956,NA,1,"Ryerson, Master. John Borie",male,13,2,2,PC 17608,262.375,B57 B59 B63 B66,C
502,0,3,"Canavan, Miss. Mary",female,21,0,0,364846,7.75,,Q
864,0,3,"Sage, Miss. Dorothy Edith ""Dolly""",female,NA,8,2,CA. 2343,69.55,,S
463,0,1,"Gee, Mr. Arthur H",male,47,0,0,111320,38.5,E63,S
1131,NA,1,"Douglas, Mrs. Walter Donald (Mahala Dutton)",female,48,1,0,PC 17761,106.425,C86,C
316,1,3,"Nilsson, Miss. Helmina Josefina",female,26,0,0,347470,7.8542,,S
911,NA,3,"Assaf Khalil, Mrs. Mariana (Miriam"")""",female,45,0,0,2696,7.225,,C
178,0,1,"Isham, Miss. Ann Elizabeth",female,50,0,0,PC 17595,28.7125,C49,C
843,1,1,"Serepeca, Miss. Augusta",female,30,0,0,113798,31,,C
280,1,3,"Abbott, Mrs. Stanton (Rosa Hunt)",female,35,1,1,C.A. 2673,20.25,,S
728,1,3,"Mannion, Miss. Margareth",female,NA,0,0,36866,7.7375,,Q
413,1,1,"Minahan, Miss. Daisy E",female,33,1,0,19928,90,C78,Q
775,1,2,"Hocking, Mrs. Elizabeth (Eliza Needs)",female,54,1,3,29105,23,,S
421,0,3,"Gheorgheff, Mr. Stanio",male,NA,0,0,349254,7.8958,,C
1257,NA,3,"Sage, Mrs. John (Annie Bullen)",female,NA,1,9,CA. 2343,69.55,,S
96,0,3,"Shorney, Mr. Charles Joseph",male,NA,0,0,374910,8.05,,S
20,1,3,"Masselmani, Mrs. Fatima",female,NA,0,0,2649,7.225,,C
611,0,3,"Andersson, Mrs. Anders Johan (Alfrida Konstantia Brogren)",female,39,1,5,347082,31.275,,S
784,0,3,"Johnston, Mr. Andrew G",male,NA,1,2,W./C. 6607,23.45,,S
730,0,3,"Ilmakangas, Miss. Pieta Sofia",female,25,1,0,STON/O2. 3101271,7.925,,S
570,1,3,"Jonsson, Mr. Carl",male,32,0,0,350417,7.8542,,S
863,1,1,"Swift, Mrs. Frederick Joel (Margaret Welles Barron)",female,48,0,0,17466,25.9292,D17,S
433,1,2,"Louch, Mrs. Charles Alexander (Alice Adelaide Slow)",female,42,1,0,SC/AH 3085,26,,S
852,0,3,"Svensson, Mr. Johan",male,74,0,0,347060,7.775,,S
535,0,3,"Cacic, Miss. Marija",female,30,0,0,315084,8.6625,,S
1021,NA,3,"Petersen, Mr. Marius",male,24,0,0,342441,8.05,,S
859,1,3,"Baclini, Mrs. Solomon (Latifa Qurban)",female,24,0,3,2666,19.2583,,C
1080,NA,3,"Sage, Miss. Ada",female,NA,8,2,CA. 2343,69.55,,S
877,0,3,"Gustafsson, Mr. Alfred Ossian",male,20,0,0,7534,9.8458,,S
1002,NA,2,"Stanton, Mr. Samuel Ward",male,41,0,0,237734,15.0458,,C
738,1,1,"Lesurer, Mr. Gustave J",male,35,0,0,PC 17755,512.3292,B101,C
187,1,3,"O'Brien, Mrs. Thomas (Johanna ""Hannah"" Godfrey)",female,NA,1,0,370365,15.5,,Q
662,0,3,"Badt, Mr. Mohamed",male,40,0,0,2623,7.225,,C
1094,NA,1,"Astor, Col. John Jacob",male,47,1,0,PC 17757,227.525,C62 C64,C
947,NA,3,"Rice, Master. Albert",male,10,4,1,382652,29.125,,Q
885,0,3,"Sutehall, Mr. Henry Jr",male,25,0,0,SOTON/OQ 392076,7.05,,S
984,NA,1,"Davidson, Mrs. Thornton (Orian Hays)",female,27,1,2,F.C. 12750,52,B71,S
4,1,1,"Futrelle, Mrs. Jacques Heath (Lily May Peel)",female,35,1,0,113803,53.1,C123,S
236,0,3,"Harknett, Miss. Alice Phoebe",female,NA,0,0,W./C. 6609,7.55,,S
400,1,2,"Trout, Mrs. William H (Jessie L)",female,28,0,0,240929,12.65,,S
580,1,3,"Jussila, Mr. Eiriik",male,32,0,0,STON/O 2. 3101286,7.925,,S
2,1,1,"Cumings, Mrs. John Bradley (Florence Briggs Thayer)",female,38,1,0,PC 17599,71.2833,C85,C
795,0,3,"Dantcheff, Mr. Ristiu",male,25,0,0,349203,7.8958,,S
1302,NA,3,"Naughton, Miss. Hannah",female,NA,0,0,365237,7.75,,Q
252,0,3,"Strom, Mrs. Wilhelm (Elna Matilda Persson)",female,29,1,1,347054,10.4625,G6,S
981,NA,2,"Wells, Master. Ralph Lester",male,2,1,1,29103,23,,S
1163,NA,3,"Fox, Mr. Patrick",male,NA,0,0,368573,7.75,,Q
1191,NA,3,"Johansson, Mr. Nils",male,29,0,0,347467,7.8542,,S
23,1,3,"McGowan, Miss. Anna ""Annie""",female,15,0,0,330923,8.0292,,Q
776,0,3,"Myhrman, Mr. Pehr Fabian Oliver Malkolm",male,18,0,0,347078,7.75,,S
722,0,3,"Jensen, Mr. Svend Lauritz",male,17,1,0,350048,7.0542,,S
1034,NA,1,"Ryerson, Mr. Arthur Larned",male,61,1,3,PC 17608,262.375,B57 B59 B63 B66,C
854,1,1,"Lines, Miss. Mary Conover",female,16,0,1,PC 17592,39.4,D28,S
1181,NA,3,"Ford, Mr. Arthur",male,NA,0,0,A/5 1478,8.05,,S
158,0,3,"Corn, Mr. Harry",male,30,0,0,SOTON/OQ 392090,8.05,,S
52,0,3,"Nosworthy, Mr. Richard Cater",male,21,0,0,A/4. 39886,7.8,,S
1013,NA,3,"Kiernan, Mr. John",male,NA,1,0,367227,7.75,,Q
9,1,3,"Johnson, Mrs. Oscar W (Elisabeth Vilhelmina Berg)",female,27,0,2,347742,11.1333,,S
912,NA,1,"Rothschild, Mr. Martin",male,55,1,0,PC 17603,59.4,,C
138,0,1,"Futrelle, Mr. Jacques Heath",male,37,1,0,113803,53.1,C123,S
750,0,3,"Connaghton, Mr. Michael",male,31,0,0,335097,7.75,,Q
1143,NA,3,"Abrahamsson, Mr. Abraham August Johannes",male,20,0,0,SOTON/O2 3101284,7.925,,S
977,NA,3,"Khalil, Mr. Betros",male,NA,1,0,2660,14.4542,,C
1070,NA,2,"Becker, Mrs. Allen Oliver (Nellie E Baumgardner)",female,36,0,3,230136,39,F4,S
94,0,3,"Dean, Mr. Bertram Frank",male,26,1,2,C.A. 2315,20.575,,S
131,0,3,"Drazenoic, Mr. Jozef",male,33,0,0,349241,7.8958,,C
1105,NA,2,"Howard, Mrs. Benjamin (Ellen Truelove Arman)",female,60,1,0,24065,26,,S
842,0,2,"Mudd, Mr. Thomas Charles",male,16,0,0,S.O./P.P. 3,10.5,,S
676,0,3,"Edvardsson, Mr. Gustaf Hjalmar",male,18,0,0,349912,7.775,,S
40,1,3,"Nicola-Yarred, Miss. Jamila",female,14,1,0,2651,11.2417,,C
495,0,3,"Stanley, Mr. Edward Roland",male,21,0,0,A/4 45380,8.05,,S
1081,NA,2,"Veal, Mr. James",male,40,0,0,28221,13,,S
135,0,2,"Sobey, Mr. Samuel James Hayden",male,25,0,0,C.A. 29178,13,,S
608,1,1,"Daniel, Mr. Robert Williams",male,27,0,0,113804,30.5,,S
992,NA,1,"Stengel, Mrs. Charles Emil Henry (Annie May Morris)",female,43,1,0,11778,55.4417,C116,C
140,0,1,"Giglio, Mr. Victor",male,24,0,0,PC 17593,79.2,B86,C
241,0,3,"Zabour, Miss. Thamine",female,NA,1,0,2665,14.4542,,C
873,0,1,"Carlsson, Mr. Frans Olof",male,33,0,0,695,5,B51 B53 B55,S
1043,NA,3,"Matinoff, Mr. Nicola",male,NA,0,0,349255,7.8958,,C
17,0,3,"Rice, Master. Eugene",male,2,4,1,382652,29.125,,Q
386,0,2,"Davies, Mr. Charles Henry",male,18,0,0,S.O.C. 14879,73.5,,S
430,1,3,"Pickard, Mr. Berk (Berk Trembisky)",male,32,0,0,SOTON/O.Q. 392078,8.05,E10,S
913,NA,3,"Olsen, Master. Artur Karl",male,9,0,1,C 17368,3.1708,,S
1287,NA,1,"Smith, Mrs. Lucien Philip (Mary Eloise Hughes)",female,18,1,0,13695,60,C31,S
334,0,3,"Vander Planke, Mr. Leo Edmondus",male,16,2,0,345764,18,,S
846,0,3,"Abbing, Mr. Anthony",male,42,0,0,C.A. 5547,7.55,,S
986,NA,1,"Birnbaum, Mr. Jakob",male,25,0,0,13905,26,,C
203,0,3,"Johanson, Mr. Jakob Alfred",male,34,0,0,3101264,6.4958,,S
350,0,3,"Dimic, Mr. Jovan",male,42,0,0,315088,8.6625,,S
1078,NA,2,"Phillips, Miss. Alice Frances Louisa",female,21,0,1,S.O./P.P. 2,21,,S
998,NA,3,"Buckley, Mr. Daniel",male,21,0,0,330920,7.8208,,Q
311,1,1,"Hays, Miss. Margaret Bechstein",female,24,0,0,11767,83.1583,C54,C
410,0,3,"Lefebre, Miss. Ida",female,NA,3,1,4133,25.4667,,S
682,1,1,"Hassab, Mr. Hammad",male,27,0,0,PC 17572,76.7292,D49,C
801,0,2,"Ponesell, Mr. Martin",male,34,0,0,250647,13,,S
126,1,3,"Nicola-Yarred, Master. Elias",male,12,1,0,2651,11.2417,,C
142,1,3,"Nysten, Miss. Anna Sofia",female,22,0,0,347081,7.75,,S
366,0,3,"Adahl, Mr. Mauritz Nils Martin",male,30,0,0,C 7076,7.25,,S
552,0,2,"Sharp, Mr. Percival James R",male,27,0,0,244358,26,,S
199,1,3,"Madigan, Miss. Margaret ""Maggie""",female,NA,0,0,370370,7.75,,Q
36,0,1,"Holverson, Mr. Alexander Oskar",male,42,1,0,113789,52,,S
379,0,3,"Betros, Mr. Tannous",male,20,0,0,2648,4.0125,,C
934,NA,3,"Goldsmith, Mr. Nathan",male,41,0,0,SOTON/O.Q. 3101263,7.85,,S
825,0,3,"Panula, Master. Urho Abraham",male,2,4,1,3101295,39.6875,,S
619,1,2,"Becker, Miss. Marion Louise",female,4,2,1,230136,39,F4,S
1103,NA,3,"Finoli, Mr. Luigi",male,NA,0,0,SOTON/O.Q. 3101308,7.05,,S
326,1,1,"Young, Miss. Marie Grice",female,36,0,0,PC 17760,135.6333,C32,C
347,1,2,"Smith, Miss. Marion Elsie",female,40,0,0,31418,13,,S
1093,NA,3,"Danbom, Master. Gilbert Sigvard Emanuel",male,0.33,0,2,347080,14.4,,S
384,1,1,"Holverson, Mrs. Alexander Oskar (Mary Aline Towner)",female,35,1,0,113789,52,,S
437,0,3,"Ford, Miss. Doolina Margaret ""Daisy""",female,21,2,2,W./C. 6608,34.375,,S
191,1,2,"Pinsky, Mrs. (Rosa)",female,32,0,0,234604,13,,S
156,0,1,"Williams, Mr. Charles Duane",male,51,0,1,PC 17597,61.3792,,C
1049,NA,3,"Lundin, Miss. Olga Elida",female,23,0,0,347469,7.8542,,S
875,1,2,"Abelson, Mrs. Samuel (Hannah Wizosky)",female,28,1,0,P/PP 3381,24,,C
587,0,2,"Jarvis, Mr. John Denzil",male,47,0,0,237565,15,,S
647,0,3,"Cor, Mr. Liudevit",male,19,0,0,349231,7.8958,,S
1055,NA,3,"Pearce, Mr. Ernest",male,NA,0,0,343271,7,,S
978,NA,3,"Barry, Miss. Julia",female,27,0,0,330844,7.8792,,Q
584,0,1,"Ross, Mr. John Hugo",male,36,0,0,13049,40.125,A10,C
754,0,3,"Jonkoff, Mr. Lalio",male,23,0,0,349204,7.8958,,S
860,0,3,"Razi, Mr. Raihed",male,NA,0,0,2629,7.2292,,C
264,0,1,"Harrison, Mr. William",male,40,0,0,112059,0,B94,S
1307,NA,3,"Saether, Mr. Simon Sivertsen",male,38.5,0,0,SOTON/O.Q. 3101262,7.25,,S
1092,NA,3,"Murphy, Miss. Nora",female,NA,0,0,36568,15.5,,Q
1145,NA,3,"Salander, Mr. Karl Johan",male,24,0,0,7266,9.325,,S
1252,NA,3,"Sage, Master. William Henry",male,14.5,8,2,CA. 2343,69.55,,S
229,0,2,"Fahlstrom, Mr. Arne Jonas",male,18,0,0,236171,13,,S
1167,NA,2,"Bryhl, Miss. Dagmar Jenny Ingeborg ",female,20,1,0,236853,26,,S
449,1,3,"Baclini, Miss. Marie Catherine",female,5,2,1,2666,19.2583,,C
938,NA,1,"Chevre, Mr. Paul Romaine",male,45,0,0,PC 17594,29.7,A9,C
772,0,3,"Jensen, Mr. Niels Peder",male,48,0,0,350047,7.8542,,S
456,1,3,"Jalsevac, Mr. Ivan",male,29,0,0,349240,7.8958,,C
299,1,1,"Saalfeld, Mr. Adolphe",male,NA,0,0,19988,30.5,C106,S
426,0,3,"Wiseman, Mr. Phillippe",male,NA,0,0,A/4. 34244,7.25,,S
202,0,3,"Sage, Mr. Frederick",male,NA,8,2,CA. 2343,69.55,,S
1229,NA,3,"Elias, Mr. Joseph",male,39,0,2,2675,7.2292,,C
664,0,3,"Coleff, Mr. Peju",male,36,0,0,349210,7.4958,,S
1244,NA,2,"Dibden, Mr. William",male,18,0,0,S.O.C. 14879,73.5,,S
1125,NA,3,"Linehan, Mr. Michael",male,NA,0,0,330971,7.8792,,Q
1247,NA,1,"Julian, Mr. Henry Forbes",male,50,0,0,113044,26,E60,S
105,0,3,"Gustafsson, Mr. Anders Vilhelm",male,37,2,0,3101276,7.925,,S
93,0,1,"Chaffee, Mr. Herbert Fuller",male,46,1,0,W.E.P. 5734,61.175,E31,S
1172,NA,3,"Oreskovic, Miss. Jelka",female,23,0,0,315085,8.6625,,S
709,1,1,"Cleaver, Miss. Alice",female,22,0,0,113781,151.55,,S
367,1,1,"Warren, Mrs. Frank Manley (Anna Sophia Atkinson)",female,60,1,0,110813,75.25,D37,C
546,0,1,"Nicholson, Mr. Arthur Ernest",male,64,0,0,693,26,,S
468,0,1,"Smart, Mr. John Montgomery",male,56,0,0,113792,26.55,,S
806,0,3,"Johansson, Mr. Karl Johan",male,31,0,0,347063,7.775,,S
387,0,3,"Goodwin, Master. Sidney Leonard",male,1,5,2,CA 2144,46.9,,S
1201,NA,3,"Hansen, Mrs. Claus Peter (Jennie L Howard)",female,45,1,0,350026,14.1083,,S
356,0,3,"Vanden Steen, Mr. Leo Peter",male,28,0,0,345783,9.5,,S
394,1,1,"Newell, Miss. Marjorie",female,23,1,0,35273,113.275,D36,C
893,NA,3,"Wilkes, Mrs. James (Ellen Needs)",female,47,1,0,363272,7,,S
797,1,1,"Leader, Dr. Alice (Farnham)",female,49,0,0,17465,25.9292,D17,S
84,0,1,"Carrau, Mr. Francisco M",male,28,0,0,113059,47.1,,S
604,0,3,"Torber, Mr. Ernst William",male,44,0,0,364511,8.05,,S
38,0,3,"Cann, Mr. Ernest Charles",male,21,0,0,A./5. 2152,8.05,,S
179,0,2,"Hale, Mr. Reginald",male,30,0,0,250653,13,,S
764,1,1,"Carter, Mrs. William Ernest (Lucile Polk)",female,36,1,2,113760,120,B96 B98,S
761,0,3,"Garfirth, Mr. John",male,NA,0,0,358585,14.5,,S
985,NA,3,"Guest, Mr. Robert",male,NA,0,0,376563,8.05,,S
538,1,1,"LeRoy, Miss. Bertha",female,30,0,0,PC 17761,106.425,,C
788,0,3,"Rice, Master. George Hugh",male,8,4,1,382652,29.125,,Q
478,0,3,"Braund, Mr. Lewis Richard",male,29,1,0,3460,7.0458,,S
599,0,3,"Boulos, Mr. Hanna",male,NA,0,0,2664,7.225,,C
1054,NA,2,"Wright, Miss. Marion",female,26,0,0,220844,13.5,,S
910,NA,3,"Ilmakangas, Miss. Ida Livija",female,27,1,0,STON/O2. 3101270,7.925,,S
747,0,3,"Abbott, Mr. Rossmore Edward",male,16,1,1,C.A. 2673,20.25,,S
545,0,1,"Douglas, Mr. Walter Donald",male,50,1,0,PC 17761,106.425,C86,C
1264,NA,1,"Ismay, Mr. Joseph Bruce",male,49,0,0,112058,0,B52 B54 B56,S
425,0,3,"Rosblom, Mr. Viktor Richard",male,18,1,1,370129,20.2125,,S
16,1,2,"Hewlett, Mrs. (Mary D Kingcome) ",female,55,0,0,248706,16,,S
841,0,3,"Alhomaki, Mr. Ilmari Rudolf",male,20,0,0,SOTON/O2 3101287,7.925,,S
144,0,3,"Burke, Mr. Jeremiah",male,19,0,0,365222,6.75,,Q
12,1,1,"Bonnell, Miss. Elizabeth",female,58,0,0,113783,26.55,C103,S
308,1,1,"Penasco y Castellana, Mrs. Victor de Satode (Maria Josefa Perez de Soto y Vallejo)",female,17,1,0,PC 17758,108.9,C65,C
1279,NA,2,"Ashby, Mr. John",male,57,0,0,244346,13,,S
816,0,1,"Fry, Mr. Richard",male,NA,0,0,112058,0,B102,S
1056,NA,2,"Peruschitz, Rev. Joseph Maria",male,41,0,0,237393,13,,S
1008,NA,3,"Thomas, Mr. John",male,NA,0,0,2681,6.4375,,C
234,1,3,"Asplund, Miss. Lillian Gertrud",female,5,4,2,347077,31.3875,,S
751,1,2,"Wells, Miss. Joan",female,4,1,1,29103,23,,S
793,0,3,"Sage, Miss. Stella Anna",female,NA,8,2,CA. 2343,69.55,,S
1102,NA,3,"Andersen, Mr. Albert Karvin",male,32,0,0,C 4001,22.525,,S
1268,NA,3,"Kink, Miss. Maria",female,22,2,0,315152,8.6625,,S
993,NA,2,"Weisz, Mr. Leopold",male,27,1,0,228414,26,,S
1138,NA,2,"Karnes, Mrs. J Frank (Claire Bennett)",female,22,0,0,F.C.C. 13534,21,,S
1179,NA,1,"Snyder, Mr. John Pillsbury",male,24,1,0,21228,82.2667,B45,S
610,1,1,"Shutes, Miss. Elizabeth W",female,40,0,0,PC 17582,153.4625,C125,S
154,0,3,"van Billiard, Mr. Austin Blyler",male,40.5,0,2,A/5. 851,14.5,,S
317,1,2,"Kantor, Mrs. Sinai (Miriam Sternin)",female,24,1,0,244367,26,,S
1299,NA,1,"Widener, Mr. George Dunton",male,50,1,1,113503,211.5,C80,C
760,1,1,"Rothes, the Countess. of (Lucy Noel Martha Dyer-Edwards)",female,33,0,0,110152,86.5,B77,S
263,0,1,"Taussig, Mr. Emil",male,52,1,1,110413,79.65,E67,S
253,0,1,"Stead, Mr. William Thomas",male,62,0,0,113514,26.55,C87,S
365,0,3,"O'Brien, Mr. Thomas",male,NA,1,0,370365,15.5,,Q
1101,NA,3,"Delalic, Mr. Redjo",male,25,0,0,349250,7.8958,,S
194,1,2,"Navratil, Master. Michel M",male,3,1,1,230080,26,F2,S
1254,NA,2,"Ware, Mrs. John James (Florence Louise Long)",female,31,0,0,CA 31352,21,,S
620,0,2,"Gavey, Mr. Lawrence",male,26,0,0,31028,10.5,,S
596,0,3,"Van Impe, Mr. Jean Baptiste",male,36,1,1,345773,24.15,,S
342,1,1,"Fortune, Miss. Alice Elizabeth",female,24,3,2,19950,263,C23 C25 C27,S
512,0,3,"Webber, Mr. James",male,NA,0,0,SOTON/OQ 3101316,8.05,,S
1171,NA,2,"Oxenham, Mr. Percy Thomas",male,22,0,0,W./C. 14260,10.5,,S
447,1,2,"Mellinger, Miss. Madeleine Violet",female,13,0,1,250644,19.5,,S
589,0,3,"Gilinski, Mr. Eliezer",male,22,0,0,14973,8.05,,S
593,0,3,"Elsbury, Mr. William James",male,47,0,0,A/5 3902,7.25,,S
314,0,3,"Hendekovic, Mr. Ignjac",male,28,0,0,349243,7.8958,,S
275,1,3,"Healy, Miss. Hanora ""Nora""",female,NA,0,0,370375,7.75,,Q
565,0,3,"Meanwell, Miss. (Marion Ogden)",female,NA,0,0,SOTON/O.Q. 392087,8.05,,S
837,0,3,"Pasic, Mr. Jakob",male,21,0,0,315097,8.6625,,S
1246,NA,3,"Dean, Miss. Elizabeth Gladys Millvina""""",female,0.17,1,2,C.A. 2315,20.575,,S
1162,NA,1,"McCaffry, Mr. Thomas Francis",male,46,0,0,13050,75.2417,C6,C
490,1,3,"Coutts, Master. Eden Leslie ""Neville""",male,9,1,1,C.A. 37671,15.9,,S
1132,NA,1,"Lindstrom, Mrs. Carl Johan (Sigrid Posse)",female,55,0,0,112377,27.7208,,C
638,0,2,"Collyer, Mr. Harvey",male,31,1,1,C.A. 31921,26.25,,S
901,NA,3,"Davies, Mr. John Samuel",male,21,2,0,A/4 48871,24.15,,S
56,1,1,"Woolner, Mr. Hugh",male,NA,0,0,19947,35.5,C52,S
671,1,2,"Brown, Mrs. Thomas William Solomon (Elizabeth Catherine Ford)",female,40,1,1,29750,39,,S
245,0,3,"Attalah, Mr. Sleiman",male,30,0,0,2694,7.225,,C
653,0,3,"Kalvik, Mr. Johannes Halvorsen",male,21,0,0,8475,8.4333,,S
957,NA,2,"Corey, Mrs. Percy C (Mary Phyllis Elizabeth Miller)",female,NA,0,0,F.C.C. 13534,21,,S
782,1,1,"Dick, Mrs. Albert Adrian (Vera Gillespie)",female,17,1,0,17474,57,B20,S
1251,NA,3,"Lindell, Mrs. Edvard Bengtsson (Elin Gerda Persson)",female,30,1,0,349910,15.55,,S
931,NA,3,"Hee, Mr. Ling",male,NA,0,0,1601,56.4958,,S
771,0,3,"Lievens, Mr. Rene Aime",male,24,0,0,345781,9.5,,S
794,0,1,"Hoyt, Mr. William Fisher",male,NA,0,0,PC 17600,30.6958,,C
450,1,1,"Peuchen, Major. Arthur Godfrey",male,52,0,0,113786,30.5,C104,S
65,0,1,"Stewart, Mr. Albert A",male,NA,0,0,PC 17605,27.7208,,C
690,1,1,"Madill, Miss. Georgette Alexandra",female,15,0,1,24160,211.3375,B5,S
554,1,3,"Leeni, Mr. Fahim (""Philip Zenni"")",male,22,0,0,2620,7.225,,C
340,0,1,"Blackwell, Mr. Stephen Weart",male,45,0,0,113784,35.5,T,S
679,0,3,"Goodwin, Mrs. Frederick (Augusta Tyler)",female,43,1,6,CA 2144,46.9,,S
1175,NA,3,"Touma, Miss. Maria Youssef",female,9,1,1,2650,15.2458,,C
1241,NA,2,"Walcroft, Miss. Nellie",female,31,0,0,F.C.C. 13528,21,,S
103,0,1,"White, Mr. Richard Frasar",male,21,0,1,35281,77.2875,D26,S
515,0,3,"Coleff, Mr. Satio",male,24,0,0,349209,7.4958,,S
419,0,2,"Matthews, Mr. William John",male,30,0,0,28228,13,,S
1024,NA,3,"Lefebre, Mrs. Frank (Frances)",female,NA,0,4,4133,25.4667,,S
435,0,1,"Silvey, Mr. William Baird",male,50,1,0,13507,55.9,E44,S
1174,NA,3,"Fleming, Miss. Honora",female,NA,0,0,364859,7.75,,Q
1154,NA,2,"Wells, Mrs. Arthur Henry (Addie"" Dart Trevaskis)""",female,29,0,2,29103,23,,S
469,0,3,"Scanlan, Mr. James",male,NA,0,0,36209,7.725,,Q
380,0,3,"Gustafsson, Mr. Karl Gideon",male,19,0,0,347069,7.775,,S
298,0,1,"Allison, Miss. Helen Loraine",female,2,1,2,113781,151.55,C22 C26,S
1074,NA,1,"Marvin, Mrs. Daniel Warner (Mary Graham Carmichael Farquarson)",female,18,1,0,113773,53.1,D30,S
352,0,1,"Williams-Lambert, Mr. Fletcher Fellows",male,NA,0,0,113510,35,C128,S
1084,NA,3,"van Billiard, Master. Walter John",male,11.5,1,1,A/5. 851,14.5,,S
455,0,3,"Peduzzi, Mr. Joseph",male,NA,0,0,A/5 2817,8.05,,S
759,0,3,"Theobald, Mr. Thomas Leonard",male,34,0,0,363294,8.05,,S
1144,NA,1,"Clark, Mr. Walter Miller",male,27,1,0,13508,136.7792,C89,C
148,0,3,"Ford, Miss. Robina Maggie ""Ruby""",female,9,2,2,W./C. 6608,34.375,,S
132,0,3,"Coelho, Mr. Domingos Fernandeo",male,20,0,0,SOTON/O.Q. 3101307,7.05,,S
849,0,2,"Harper, Rev. John",male,28,0,1,248727,33,,S
1301,NA,3,"Peacock, Miss. Treasteall",female,3,1,1,SOTON/O.Q. 3101315,13.775,,S
439,0,1,"Fortune, Mr. Mark",male,64,1,4,19950,263,C23 C25 C27,S
805,1,3,"Hedman, Mr. Oskar Arvid",male,27,0,0,347089,6.975,,S
1067,NA,2,"Brown, Miss. Edith Eileen",female,15,0,2,29750,39,,S
444,1,2,"Reynaldo, Ms. Encarnacion",female,28,0,0,230434,13,,S
408,1,2,"Richards, Master. William Rowe",male,3,1,1,29106,18.75,,S
57,1,2,"Rugg, Miss. Emily",female,21,0,0,C.A. 31026,10.5,,S
716,0,3,"Soholt, Mr. Peter Andreas Lauritz Andersen",male,19,0,0,348124,7.65,F G73,S
238,1,2,"Collyer, Miss. Marjorie ""Lottie""",female,8,0,2,C.A. 31921,26.25,,S
663,0,1,"Colley, Mr. Edward Pomeroy",male,47,0,0,5727,25.5875,E58,S
343,0,2,"Collander, Mr. Erik Gustaf",male,28,0,0,248740,13,,S
113,0,3,"Barton, Mr. David John",male,22,0,0,324669,8.05,,S
572,1,1,"Appleton, Mrs. Edward Dale (Charlotte Lamson)",female,53,2,0,11769,51.4792,C101,S
1272,NA,3,"O'Connor, Mr. Patrick",male,NA,0,0,366713,7.75,,Q
744,0,3,"McNamee, Mr. Neal",male,24,1,0,376566,16.1,,S
1110,NA,1,"Widener, Mrs. George Dunton (Eleanor Elkins)",female,50,1,1,113503,211.5,C80,C
368,1,3,"Moussa, Mrs. (Mantoura Boulos)",female,NA,0,0,2626,7.2292,,C
274,0,1,"Natsch, Mr. Charles H",male,37,0,1,PC 17596,29.7,C118,C
1295,NA,1,"Carrau, Mr. Jose Pedro",male,17,0,0,113059,47.1,,S
741,1,1,"Hawksford, Mr. Walter James",male,NA,0,0,16988,30,D45,S
1173,NA,3,"Peacock, Master. Alfred Edward",male,0.75,1,1,SOTON/O.Q. 3101315,13.775,,S
401,1,3,"Niskanen, Mr. Juha",male,39,0,0,STON/O 2. 3101289,7.925,,S
22,1,2,"Beesley, Mr. Lawrence",male,34,0,0,248698,13,D56,S
292,1,1,"Bishop, Mrs. Dickinson H (Helen Walton)",female,19,1,0,11967,91.0792,B49,C
240,0,2,"Hunt, Mr. George Henry",male,33,0,0,SCO/W 1585,12.275,,S
363,0,3,"Barbara, Mrs. (Catherine David)",female,45,0,1,2691,14.4542,,C
626,0,1,"Sutton, Mr. Frederick",male,61,0,0,36963,32.3208,D50,S
231,1,1,"Harris, Mrs. Henry Birkhardt (Irene Wallach)",female,35,1,0,36973,83.475,C83,S
412,0,3,"Hart, Mr. Henry",male,NA,0,0,394140,6.8583,,Q
840,1,1,"Marechal, Mr. Pierre",male,NA,0,0,11774,29.7,C47,C
748,1,2,"Sinkkonen, Miss. Anna",female,30,0,0,250648,13,,S
1275,NA,3,"McNamee, Mrs. Neal (Eileen O'Leary)",female,19,1,0,376566,16.1,,S
125,0,1,"White, Mr. Percival Wayland",male,54,0,1,35281,77.2875,D26,S
979,NA,3,"Badman, Miss. Emily Louisa",female,18,0,0,A/4 31416,8.05,,S
1219,NA,1,"Rosenshine, Mr. George (Mr George Thorne"")""",male,46,0,0,PC 17585,79.2,,C
529,0,3,"Salonen, Mr. Johan Werner",male,39,0,0,3101296,7.925,,S
1232,NA,2,"Fillbrook, Mr. Joseph Charles",male,18,0,0,C.A. 15185,10.5,,S
680,1,1,"Cardeza, Mr. Thomas Drake Martinez",male,36,0,1,PC 17755,512.3292,B51 B53 B55,C
853,0,3,"Boulos, Miss. Nourelain",female,9,1,1,2678,15.2458,,C
1250,NA,3,"O'Keefe, Mr. Patrick",male,NA,0,0,368402,7.75,,Q
91,0,3,"Christmann, Mr. Emil",male,29,0,0,343276,8.05,,S
215,0,3,"Kiernan, Mr. Philip",male,NA,1,0,367229,7.75,,Q
13,0,3,"Saundercock, Mr. William Henry",male,20,0,0,A/5. 2151,8.05,,S
856,1,3,"Aks, Mrs. Sam (Leah Rosen)",female,18,0,1,392091,9.35,,S
827,0,3,"Lam, Mr. Len",male,NA,0,0,1601,56.4958,,S
513,1,1,"McGough, Mr. James Robert",male,36,0,0,PC 17473,26.2875,E25,S
683,0,3,"Olsvigen, Mr. Thor Anderson",male,20,0,0,6563,9.225,,S
213,0,3,"Perkin, Mr. John Henry",male,22,0,0,A/5 21174,7.25,,S
1280,NA,3,"Canavan, Mr. Patrick",male,21,0,0,364858,7.75,,Q
442,0,3,"Hampe, Mr. Leon",male,20,0,0,345769,9.5,,S
717,1,1,"Endres, Miss. Caroline Louise",female,38,0,0,PC 17757,227.525,C45,C
567,0,3,"Stoytcheff, Mr. Ilia",male,19,0,0,349205,7.8958,,S
973,NA,1,"Straus, Mr. Isidor",male,67,1,0,PC 17483,221.7792,C55 C57,S
1127,NA,3,"Vendel, Mr. Olof Edvin",male,20,0,0,350416,7.8542,,S
182,0,2,"Pernot, Mr. Rene",male,NA,0,0,SC/PARIS 2131,15.05,,C
233,0,2,"Sjostedt, Mr. Ernst Adolf",male,59,0,0,237442,13.5,,S
416,0,3,"Meek, Mrs. Thomas (Annie Louise Rowley)",female,NA,0,0,343095,8.05,,S
707,1,2,"Kelly, Mrs. Florence ""Fannie""",female,45,0,0,223596,13.5,,S
32,1,1,"Spencer, Mrs. William Augustus (Marie Eugenie)",female,NA,1,0,PC 17569,146.5208,B78,C
476,0,1,"Clifford, Mr. George Quincy",male,NA,0,0,110465,52,A14,S
483,0,3,"Rouse, Mr. Richard Henry",male,50,0,0,A/5 3594,8.05,,S
1168,NA,2,"Parker, Mr. Clifford Richard",male,28,0,0,SC 14888,10.5,,S
100,0,2,"Kantor, Mr. Sinai",male,34,1,0,244367,26,,S
1285,NA,2,"Gilbert, Mr. William",male,47,0,0,C.A. 30769,10.5,,S
891,0,3,"Dooley, Mr. Patrick",male,32,0,0,370376,7.75,,Q
625,0,3,"Bowen, Mr. David John ""Dai""",male,21,0,0,54636,16.1,,S
735,0,2,"Troupiansky, Mr. Moses Aaron",male,23,0,0,233639,13,,S
452,0,3,"Hagland, Mr. Ingvald Olai Olsen",male,NA,1,0,65303,19.9667,,S
719,0,3,"McEvoy, Mr. Michael",male,NA,0,0,36568,15.5,,Q
329,1,3,"Goldsmith, Mrs. Frank John (Emily Alice Brown)",female,31,1,1,363291,20.525,,S
391,1,1,"Carter, Mr. William Ernest",male,36,1,2,113760,120,B96 B98,S
1095,NA,2,"Quick, Miss. Winifred Vera",female,8,1,1,26360,26,,S
137,1,1,"Newsom, Miss. Helen Monypeny",female,19,0,2,11752,26.2833,D47,S
1090,NA,2,"Baimbrigge, Mr. Charles Robert",male,23,0,0,C.A. 31030,10.5,,S
225,1,1,"Hoyt, Mr. Frederick Maxfield",male,38,1,0,19943,90,C93,S
251,0,3,"Reed, Mr. James George",male,NA,0,0,362316,7.25,,S
248,1,2,"Hamalainen, Mrs. William (Anna)",female,24,0,2,250649,14.5,,S
293,0,2,"Levy, Mr. Rene Jacques",male,36,0,0,SC/Paris 2163,12.875,D,C
551,1,1,"Thayer, Mr. John Borland Jr",male,17,0,2,17421,110.8833,C70,C
351,0,3,"Odahl, Mr. Nils Martin",male,23,0,0,7267,9.225,,S
243,0,2,"Coleridge, Mr. Reginald Charles",male,29,0,0,W./C. 14263,10.5,,S
1146,NA,3,"Wenzel, Mr. Linhart",male,32.5,0,0,345775,9.5,,S
899,NA,2,"Caldwell, Mr. Albert Francis",male,26,1,1,248738,29,,S
1237,NA,3,"Abelseth, Miss. Karen Marie",female,16,0,0,348125,7.65,,S
678,1,3,"Turja, Miss. Anna Sofia",female,18,0,0,4138,9.8417,,S
129,1,3,"Peter, Miss. Anna",female,NA,1,1,2668,22.3583,F E69,C
198,0,3,"Olsen, Mr. Karl Siegwart Andreas",male,42,0,1,4579,8.4042,,S
790,0,1,"Guggenheim, Mr. Benjamin",male,46,0,0,PC 17593,79.2,B82 B84,C
622,1,1,"Kimball, Mr. Edwin Nelson Jr",male,42,1,0,11753,52.5542,D19,S
1184,NA,3,"Nasr, Mr. Mustafa",male,NA,0,0,2652,7.2292,,C
1075,NA,3,"Lane, Mr. Patrick",male,NA,0,0,7935,7.75,,Q
258,1,1,"Cherry, Miss. Gladys",female,30,0,0,110152,86.5,B77,S
528,0,1,"Farthing, Mr. John",male,NA,0,0,PC 17483,221.7792,C95,S
710,1,3,"Moubarek, Master. Halim Gonios (""William George"")",male,NA,1,1,2661,15.2458,,C
586,1,1,"Taussig, Miss. Ruth",female,18,0,2,110413,79.65,E68,S
361,0,3,"Skoog, Mr. Wilhelm",male,40,1,4,347088,27.9,,S
262,1,3,"Asplund, Master. Edvin Rojj Felix",male,3,4,2,347077,31.3875,,S
1044,NA,3,"Storey, Mr. Thomas",male,60.5,0,0,3701,NA,,S
166,1,3,"Goldsmith, Master. Frank John William ""Frankie""",male,9,0,2,363291,20.525,,S
811,0,3,"Alexander, Mr. William",male,26,0,0,3474,7.8875,,S
246,0,1,"Minahan, Dr. William Edward",male,44,2,0,19928,90,C78,Q
640,0,3,"Thorneycroft, Mr. Percival",male,NA,1,0,376564,16.1,,S
310,1,1,"Francatelli, Miss. Laura Mabel",female,30,0,0,PC 17485,56.9292,E36,C
988,NA,1,"Cavendish, Mrs. Tyrell William (Julia Florence Siegel)",female,76,1,0,19877,78.85,C46,S
1274,NA,3,"Risien, Mrs. Samuel (Emma)",female,NA,0,0,364498,14.5,,S
345,0,2,"Fox, Mr. Stanley Hubert",male,36,0,0,229236,13,,S
1294,NA,1,"Gibson, Miss. Dorothy Winifred",female,22,0,1,112378,59.4,,C
39,0,3,"Vander Planke, Miss. Augusta Maria",female,18,2,0,345764,18,,S
1220,NA,2,"Clarke, Mr. Charles Valentine",male,29,1,0,2003,26,,S
332,0,1,"Partner, Mr. Austen",male,45.5,0,0,113043,28.5,C124,S
461,1,1,"Anderson, Mr. Harry",male,48,0,0,19952,26.55,E12,S
540,1,1,"Frolicher, Miss. Hedwig Margaritha",female,22,0,2,13568,49.5,B39,C
980,NA,3,"O'Donoghue, Ms. Bridget",female,NA,0,0,364856,7.75,,Q
